{
  "schema": "struktly/packet/v2",
  "generated_at": "2026-07-11T12:00:00Z",
  "metadata": {
    "generated_at": "2026-07-11T12:00:00Z",
    "absolute_git_root": "."
  },
  "repository": {
    "name": "go-service",
    "identity": "git:9e32ee6a0f32d5c9fb24e98545a74619da682cba8248d369648c707ad8112c40",
    "vcs": "git",
    "root": ".",
    "branch": "main",
    "head_revision": "bbf50c1ba03f95b993b74ece34f282d51deb63dd",
    "base_revision": "bbf50c1ba03f95b993b74ece34f282d51deb63dd"
  },
  "items": [
    {
      "kind": "declaration",
      "path": ".struktly/constraints.md",
      "content": "# Constraints\n\n- Keep handler latency under 200ms.\n- No new third-party dependencies without a decision record.\n",
      "content_hash": "sha256:81564faaa40d080d602077a0bfc444e5599f68f165e1c603c89ee505e5292485",
      "provenance": {
        "source": ".struktly/constraints.md",
        "revision": "bbf50c1ba03f95b993b74ece34f282d51deb63dd",
        "method": "selection_rule",
        "confidence": "detected"
      },
      "reason": "selection_rule",
      "original_bytes": 112,
      "included_bytes": 112,
      "truncated": false
    },
    {
      "kind": "declaration",
      "path": ".struktly/direction.md",
      "content": "---\ntype: direction\ntitle: \"Repository Direction\"\ndescription: \"Direction for the go-service fixture.\"\ntimestamp: 2026-07-01T00:00:00Z\n---\n\n# Direction\n\nShip a reliable payments API with strict timeouts on every outbound call.\n\n## Non-goals\n\n- No new public endpoints until the middleware chain is hardened.\n",
      "content_hash": "sha256:1fff95fc45cbaa0c04fe78855816cc3d507df5e85b3b1c097ec98a5e12af0057",
      "provenance": {
        "source": ".struktly/direction.md",
        "revision": "bbf50c1ba03f95b993b74ece34f282d51deb63dd",
        "method": "selection_rule",
        "confidence": "detected"
      },
      "reason": "selection_rule",
      "original_bytes": 308,
      "included_bytes": 308,
      "truncated": false
    },
    {
      "kind": "manifest",
      "path": "Makefile",
      "content": "test:\n\tgo test ./...\n\nbuild:\n\tgo build ./...\n",
      "content_hash": "sha256:e450912e118fd02bee73756f442a14547c1f17ce479dc9ab319b985468514bb9",
      "provenance": {
        "source": "Makefile",
        "revision": "bbf50c1ba03f95b993b74ece34f282d51deb63dd",
        "method": "selection_rule",
        "confidence": "detected"
      },
      "reason": "selection_rule",
      "original_bytes": 45,
      "included_bytes": 45,
      "truncated": false
    },
    {
      "kind": "documentation",
      "path": "README.md",
      "content": "# Go Service\n\nA small payments API used as a Struktly scan fixture.\n\n## Development\n\nRun `make test` before sending changes.\n",
      "content_hash": "sha256:3358d5eb78ed93bd2419ed728bc1049ce2a689cb87ca55325ae0ceb4f48c962b",
      "provenance": {
        "source": "README.md",
        "revision": "bbf50c1ba03f95b993b74ece34f282d51deb63dd",
        "method": "selection_rule",
        "confidence": "detected"
      },
      "reason": "selection_rule",
      "original_bytes": 125,
      "included_bytes": 125,
      "truncated": false
    },
    {
      "kind": "manifest",
      "path": "go.mod",
      "content": "module example.com/go-service\n\ngo 1.24.0\n",
      "content_hash": "sha256:f6c2e852e2767de6925f0cdffc43aceb1ccd9192f70473b0f0407448a4886ce1",
      "provenance": {
        "source": "go.mod",
        "revision": "bbf50c1ba03f95b993b74ece34f282d51deb63dd",
        "method": "selection_rule",
        "confidence": "detected"
      },
      "reason": "selection_rule",
      "original_bytes": 41,
      "included_bytes": 41,
      "truncated": false
    },
    {
      "kind": "source",
      "path": "internal/clock/clock.go",
      "content": "// Package clock supplies the wall-clock source middleware depends on.\npackage clock\n\nimport \"time\"\n\n// Grace is the deadline applied when none is configured.\nconst Grace = 30 * time.Second\n\n// Wall returns the current instant.\nfunc Wall() time.Time { return time.Now() }\n",
      "content_hash": "sha256:7f86d528f399fab5677a123f8fcee25b6ed6d7b4311a3c1df073682c183555a9",
      "provenance": {
        "source": "internal/clock/clock.go",
        "revision": "bbf50c1ba03f95b993b74ece34f282d51deb63dd",
        "location": "provides:Grace",
        "method": "import_neighbor",
        "confidence": "detected"
      },
      "reason": "import_neighbor",
      "original_bytes": 272,
      "included_bytes": 272,
      "truncated": false
    },
    {
      "kind": "source",
      "path": "middleware/logger.go",
      "content": "package middleware\n\nimport (\n\t\"log\"\n\t\"net/http\"\n)\n\n// Logger logs each request method and path.\nfunc Logger(h http.Handler) http.Handler {\n\treturn http.HandlerFunc(func(w http.ResponseWriter, r *http.Request) {\n\t\tlog.Printf(\"%s %s\", r.Method, r.URL.Path)\n\t\th.ServeHTTP(w, r)\n\t})\n}\n",
      "content_hash": "sha256:79ab9481be7e91f1130665b0c50407af6c808a804d625e2d625837b3d517f21a",
      "provenance": {
        "source": "middleware/logger.go",
        "revision": "bbf50c1ba03f95b993b74ece34f282d51deb63dd",
        "method": "task_match",
        "confidence": "detected"
      },
      "reason": "task_match",
      "original_bytes": 281,
      "included_bytes": 281,
      "truncated": false
    },
    {
      "kind": "source",
      "path": "middleware/timeout.go",
      "content": "// Package middleware provides HTTP middleware for the service.\npackage middleware\n\nimport (\n\t\"net/http\"\n\n\t\"example.com/go-service/internal/clock\"\n)\n\n// Timeout wraps h with a fixed request timeout.\nfunc Timeout(h http.Handler) http.Handler {\n\treturn http.TimeoutHandler(h, clock.Grace, \"request timed out\")\n}\n",
      "content_hash": "sha256:e59afd85a547cb059a77ab04fcfe46c2e2cc1b0697ae07cc12ac5a7c7f16c1bd",
      "provenance": {
        "source": "middleware/timeout.go",
        "revision": "bbf50c1ba03f95b993b74ece34f282d51deb63dd",
        "location": "declares:Timeout",
        "method": "task_match",
        "confidence": "detected"
      },
      "reason": "task_match",
      "original_bytes": 310,
      "included_bytes": 310,
      "truncated": false
    }
  ],
  "required_checks": [],
  "suggested_checks": [
    "go build ./...",
    "go test ./...",
    "go vet ./...",
    "make build",
    "make test"
  ],
  "exclusions": [],
  "truncations": [],
  "limits": {
    "max_items": 40,
    "max_file_bytes": 65536,
    "max_total_bytes": 524288
  },
  "packet_hash": "sha256:7d15b90f6e98d6e24df04708c31b31cb48f61dfd31226a9f9149d0f7f8c6ec8d",
  "task": "add request timeout middleware",
  "direction": "# Direction\n\nShip a reliable payments API with strict timeouts on every outbound call.\n\n## Non-goals\n\n- No new public endpoints until the middleware chain is hardened.",
  "constraints": "# Constraints\n\n- Keep handler latency under 200ms.\n- No new third-party dependencies without a decision record.",
  "verification_commands": [
    "go build ./...",
    "go test ./...",
    "go vet ./...",
    "make build",
    "make test"
  ],
  "docs": [
    "README.md",
    "docs/adr/0001-record.md",
    "docs/architecture.md"
  ],
  "suggested_files": [
    "README.md",
    "docs/adr/0001-record.md",
    "middleware/",
    "middleware/timeout.go"
  ],
  "source_refs": [
    ".struktly/constraints.md",
    ".struktly/direction.md",
    "Makefile",
    "README.md",
    "docs/adr/0001-record.md",
    "docs/architecture.md",
    "go.mod"
  ]
}
