{
  "schema": "struktly/packet/v2",
  "generated_at": "2026-07-11T12:00:00Z",
  "metadata": {
    "generated_at": "2026-07-11T12:00:00Z",
    "absolute_git_root": "."
  },
  "repository": {
    "name": "noisy-legacy",
    "identity": "git:1168f74c9e90c15390b4e6f53975a8471636ca941879d877eb982e4945447bd1",
    "vcs": "git",
    "root": ".",
    "branch": "main",
    "head_revision": "51632cd3c819af13d20ca87974e07f214f2797e1",
    "base_revision": "51632cd3c819af13d20ca87974e07f214f2797e1"
  },
  "items": [
    {
      "kind": "manifest",
      "path": "Makefile",
      "content": "test:\n\tgo test ./...\n",
      "content_hash": "sha256:57d3973f34968810f6110671fdcdea344c0cccdd329118e67184e5dbaa5125ce",
      "provenance": {
        "source": "Makefile",
        "revision": "51632cd3c819af13d20ca87974e07f214f2797e1",
        "method": "selection_rule",
        "confidence": "detected"
      },
      "reason": "selection_rule",
      "original_bytes": 21,
      "included_bytes": 21,
      "truncated": false
    },
    {
      "kind": "documentation",
      "path": "README.md",
      "content": "# Noisy Legacy\n\nA service with stale directories used as a Struktly scan fixture.\n",
      "content_hash": "sha256:101b7771d85d2fe6d76bcc745259b5eb719a5c384760b12fcc929de6228a769d",
      "provenance": {
        "source": "README.md",
        "revision": "51632cd3c819af13d20ca87974e07f214f2797e1",
        "method": "selection_rule",
        "confidence": "detected"
      },
      "reason": "selection_rule",
      "original_bytes": 82,
      "included_bytes": 82,
      "truncated": false
    },
    {
      "kind": "manifest",
      "path": "go.mod",
      "content": "module example.com/noisy-legacy\n\ngo 1.24.0\n",
      "content_hash": "sha256:72f802eedaabfd858e4c10b5c12ab57b028689f265973a7bc22fbdc97ba2fe09",
      "provenance": {
        "source": "go.mod",
        "revision": "51632cd3c819af13d20ca87974e07f214f2797e1",
        "method": "selection_rule",
        "confidence": "detected"
      },
      "reason": "selection_rule",
      "original_bytes": 43,
      "included_bytes": 43,
      "truncated": false
    }
  ],
  "required_checks": [],
  "suggested_checks": [
    "go build ./...",
    "go test ./...",
    "go vet ./...",
    "make test"
  ],
  "exclusions": [],
  "truncations": [],
  "limits": {
    "max_items": 40,
    "max_file_bytes": 65536,
    "max_total_bytes": 524288
  },
  "packet_hash": "sha256:a54be658daa8cd4f08a8f26410b66c668c5721b1f9bc4a0673ccbab38603c868",
  "task": "add request timeout middleware",
  "verification_commands": [
    "go build ./...",
    "go test ./...",
    "go vet ./...",
    "make test"
  ],
  "docs": [
    "README.md",
    "docs/current.md"
  ],
  "suggested_files": [
    "README.md"
  ],
  "source_refs": [
    "Makefile",
    "README.md",
    "docs/current.md",
    "go.mod"
  ]
}
